ID;thesis_title;thesis_keywords;student_faculty;student_level;Problématique;interet;Méthode;technologies;description_sujet
624;Réalisation d'un banc de test automatisé pour contacteurs et disjoncteurs;Maintenance, Test, Elec;Genie Electrique;L3;Comment vérifier la fiabilité des organes de coupure avant installation ?;Garantie de la sécurité des installations industrielles.;Séquençage de cycles d'ouverture/fermeture et mesure du temps de réponse.;API (Automate), LabVIEW;Système de banc d'essai électrique.
625;Étude et conception d'une éolienne de petite puissance pour usage domestique;Énergie, Éolien, Alternateur;Genie Electrique;L3;Comment produire de l'électricité à partir de vents faibles en milieu urbain ?;Autoconsommation énergétique et réduction de la dépendance au réseau.;Dimensionnement des pales et choix du générateur à aimants permanents.;CAO mécanique, Alternateur;Micro-éolienne domestique.
626;Mise en œuvre d'un système de télésurveillance des postes de transformation HT/BT;Réseau, Scada, Monitoring;Genie Electrique;TECH2;Comment être alerté en temps réel d'une ouverture de disjoncteur à distance ?;Réduction du temps d'interruption (downtime) sur le réseau.;Interfaçage de capteurs de courant/tension avec transmission GSM.;RTU, Protocole DNP3/IEC 60870;Système de télégestion de réseau.
627;Étude de l'efficacité d'un système de pompage solaire direct sans batterie;Agro, Solaire, Pompe;Genie Electrique;L3;Comment optimiser l'irrigation agricole avec un coût de maintenance minimal ?;Développement durable de l'agriculture locale.;Adaptation d'impédance (MPPT) entre les panneaux et le moteur de pompe.;Variateur de pompage solaire;Station de pompage photovoltaïque.
628;Réalisation d'un détecteur de court-circuit et de défaut d'isolement localisé;Sécurité, Maintenance, Elec;Genie Electrique;L3;Comment trouver précisément l'emplacement d'un défaut dans un câblage complexe ?;Gain de temps pour la maintenance des installations électriques.;Mesure de la résistance d'isolement et injection de signal traceur.;Mégaohmmètre, Tracker RF;Outil de diagnostic électrique.
629;Conception d'un onduleur monophasé à onde sinusoïdale pure (Pure Sine Wave);Électronique Puissance, Onduleur;Genie Electrique;TECH2;Pourquoi les onduleurs à onde carrée endommagent-ils les équipements sensibles ?;Protection des appareils électroménagers et électroniques.;Utilisation du filtrage LC en sortie de pont en H.;MOSFETs, Filtrage passif;Onduleur de puissance domestique.
630;Étude de la récupération d'énergie thermique (Seebeck) pour petits capteurs;Énergie, Thermoelectric, IoT;Genie Electrique;L3;Comment alimenter un capteur sans batterie en utilisant la chaleur d'un moteur ?;Autonomie énergétique pour les capteurs en milieu industriel.;Utilisation de modules Peltier et convertisseur Boost très basse tension.;Modules TEG, LTC3108;Moissonneur d'énergie thermique.
631;Analyse de l'échauffement des câbles enterrés en fonction de la nature du sol;Électricité, Thermique, Réseau;Genie Electrique;TECH2;Comment dimensionner la section des câbles pour éviter la fusion de l'isolant ?;Sécurisation et longévité des réseaux électriques souterrains.;Calcul de la résistance thermique du sol et courant admissible.;Logiciels de calcul thermique;Étude de dimensionnement de conducteurs.
632;Réalisation d’une application multiplateforme permettant de connecter un compte bancaire à des appareils connectés (smartphone, tablette, ordinateur) pour des paiements simples, rapides et sécurisés.;application multiplateforme, paiements mobiles, compte bancaire connecté, cryptage, API, Flutter, React Native;Genie Electrique;L3;Comment sécuriser le transfert de fonds entre une plateforme mobile et un compte bancaire ?;Inclusion financière et paiements numériques;Développement d API et cryptage;Flutter, API bancaires;Interface mobile sécurisée pour la gestion de fonds bancaires
633;Réalisation d'une serrure électronique par reconnaissance vocale;Électronique, Sécurité, Vocal;Genie Electrique;L3;Comment sécuriser l'accès à un local technique sans clé physique ?;Modernisation de la sécurité d'accès.;Traitement de signal audio et comparaison d'empreintes vocales.;Module VR (Voice Recognition), Relais;Système de verrouillage intelligent.
634;Optimisation des systèmes photovoltaïques en République Démocratique du Congo (RDC) : étude et développement de micro-réseaux intelligents (smart grids) intégrant des solutions de stockage par batterie, adaptés aux conditions climatiques et aux réalités économiques locales.;systèmes photovoltaïques, micro‑réseaux intelligents, stockage par batteries, smart grids, conditions climatiques RDC;Genie Electrique;L3;Quelles stratégies techniques permettent de maximiser l autoconsommation solaire en RDC ?;Réduction de la facture et autonomie face aux délestages;Simulation énergétique PV;PVsyst, Smart Grid, Batteries;Optimisation des installations solaires domestiques et industrielles en RDC
635;Conception d'un stabilisateur de tension numérique de haute puissance;Électricité, Régulation, Tension;Genie Electrique;L3;Comment protéger une machine industrielle contre les chutes de tension du réseau ?;Protection des investissements matériels en zone de réseau instable.;Commutation de prises de transformateur par servomoteur ou statique.;Servomoteur, Microcontrôleur;Régulateur de tension secteur.
636;Étude de l'intégration des énergies renouvelable dans les réseaux électriques pour venir en aide au milieu réculé de la RDC;énergies renouvelables, réseaux électriques en zones reculées, RDC, amélioration de l’accès à l’électricité;Genie Electrique;L3;Comment stabiliser la fréquence du réseau lors de l injection d énergies intermittentes ?;Augmentation du mix énergétique vert national;Simulation de stabilité réseau;ETAP, MATLAB, Onduleurs;Gestion de réseau intelligent avec passerelle vers le contrôle prédictif
637;Étude du vieillissement des isolateurs HT sous conditions de pollution saline;Haute Tension, Isolateurs;Genie Electrique;TECH2;Comment prévenir les arcs électriques (flashovers) sur les lignes côtières ?;Amélioration de la fiabilité du transport d'énergie en zone littorale.;Analyse du courant de fuite et modélisation de la couche de pollution.;Essais en laboratoire, Diélectrique;Recherche sur l'isolation haute tension.
638;Étude et mise en œuvre de transfert de l'énergie électrique par induction: application à la voiture électrique;transfert d’énergie électrique sans fil, induction électromagnétique, voiture électrique, rendement, électronique de puissance;Genie Electrique;L3;Quelle efficacité de transfert peut on atteindre pour la recharge sans fil d un véhicule ?;Innovation dans les infrastructures de transport;Expérimentation couplage inductif résonant;Bobines, Électronique de puissance;Recharge sans fil par induction avec passerelle vers la recharge dynamique
639;Étude et réalisation d'un système de freinage par injection de courant continu;Électrotechnique, Moteur, Freinage;Genie Electrique;TECH2;Comment arrêter instantanément un moteur asynchrone sans usure mécanique ?;Sécurité des opérateurs et précision des arrêts sur machines industrielles.;Injection d'une tension continue dans les enroulements statoriques.;Redresseur commandé, Relais;Dispositif de freinage d'urgence pour moteurs.
640;Conception d'un suiveur solaire (Tracker) à deux axes par commande astronomique;Énergie, Solaire, Automatisme;Genie Electrique;L3;Comment maximiser le rendement des panneaux photovoltaïques toute la journée ?;Augmentation de la production énergétique (jusqu'à 40% de gain).;Calcul de la position du soleil par algorithme et pilotage de moteurs.;Arduino, RTC, Servomoteurs;Système de positionnement solaire intelligent.
641;Analyse de la sélectivité des protections dans une installation industrielle complexe;Protection, Électricité, Sécurité;Genie Electrique;TECH2;Comment éviter qu'un défaut sur une machine ne fasse disjoncter toute l'usine ?;Continuité de service et localisation rapide des pannes.;Étude des courbes de déclenchement (ampèremétriques et chronométriques).;Logiciels de calcul (ex: ECODIAL);Étude de coordination des protections.
642;Réalisation d'un automate de gestion pour un système de lavage automobile;Automatisme, Capteurs, API;Genie Electrique;L3;Comment automatiser les cycles de lavage et de rinçage sans intervention humaine ?;Rentabilité commerciale et gestion optimale de la consommation d'eau.;Programmation d'un cycle logique avec détection de présence véhicule.;API Schneider/Siemens;Système de contrôle de process automatisé.
643;Étude et conception d'un onduleur de secours (UPS) pour équipements médicaux;Électricité, Onduleur, Santé;Genie Electrique;L3;Comment garantir une tension stable et sans coupure pour un respirateur ?;Survie des patients lors des micro-coupures ou instabilités réseau.;Conversion DC/AC haute fidélité avec basculement ultra-rapide (<10ms).;MOSFET, Batterie Gel;Alimentation Sans Interruption (ASI) médicale.
644;Conception d'un système de détection d'arc électrique dans les armoires TGBT;Sécurité, Incendie, Électricité;Genie Electrique;TECH2;Comment prévenir les incendies d'origine électrique avant qu'ils ne se propagent ?;Protection des infrastructures lourdes et des personnes.;Détection de signatures spectrales d'arcs et coupure immédiate.;Capteurs optiques, Micro;Dispositif de sécurité incendie électrique.
645;Réalisation d'un balance électronique industrielle de haute précision (jusqu'à 500kg);Instrumentation, Capteurs;Genie Electrique;L3;Comment mesurer avec précision des charges lourdes dans un milieu vibrant ?;Fiabilisation des pesées pour le commerce et l'industrie.;Utilisation de jauges de contrainte et filtrage numérique du signal.;HX711, Arduino;Système de pesage industriel connecté.
646;Étude de l'impact des variations de fréquence sur les moteurs synchrones;Électrotechnique, Machine;Genie Electrique;TECH2;Pourquoi un moteur synchrone décroche-t-il lors d'une instabilité du réseau ?;Compréhension des limites d'exploitation des machines de production.;Analyse du couple de torsion et de l'angle de charge sous contrainte.;MATLAB/Simulink;Étude de dynamique des machines électriques.
647;Système de diagnostic des maladies courantes en zones rurales de la RDC assisté par l'intelligence artificielle;diagnostic de maladies courantes, zones rurales de RDC, intelligence artificielle, Flask, Python, système d’aide médicale;Genie Electrique;L3;Comment proposer un outil de diagnostic préliminaire fiable via smartphone pour zones isolées ?;Soutien médical en zone à faible couverture sanitaire;Développement App mobile et logique décision;Flask, Python, Mobile App;Outil de télémédecine avec passerelle vers l IA de diagnostic par image
648;Conception d'un système de chauffage par induction pour petites pièces métalliques;Électronique Puissance, Induction;Genie Electrique;L3;Comment chauffer du métal localement sans flamme et de façon sécurisée ?;Modernisation des ateliers de mécanique et soudure.;Création d'un champ magnétique haute fréquence via un circuit résonant.;Transistors de puissance, Bobines;Prototype de forge à induction.
649;Réalisation d'un système de monitoring à distance pour groupes électrogènes;Énergie, Maintenance, IoT;Genie Electrique;L3;Comment surveiller le niveau de carburant et la pression d'huile à distance ?;Optimisation de la maintenance et lutte contre le vol de carburant.;Capteurs analogiques couplés à un module de transmission GSM/GPRS.;ESP32, SIM800L;Télé-supervision d'équipement de secours.
650;Étude et mise en œuvre d'une régulation de niveau d'eau par logique floue;Automatisme, Régulation;Genie Electrique;TECH2;Comment stabiliser le niveau d'un réservoir malgré des variations de débit ?;Précision accrue par rapport à une régulation Tout-Ou-Rien classique.;Modélisation des règles linguistiques et commande de pompe.;LabVIEW / Arduino;Système de contrôle de niveau intelligent.
651;Conception d'un analyseur de spectre audio à base de microcontrôleur;Électronique, Signal;Genie Electrique;L3;Comment visualiser les fréquences d'un signal sonore en temps réel ?;Outil pédagogique pour l'étude du son et de l'acoustique.;Transformation de Fourier Rapide (FFT) appliquée au signal analogique.;Écran LCD, Microcontrôleur;Instrumentation de traitement du signal.
652;Analyse des pertes énergétiques dans les réseaux de transport HT locaux;Électricité, Réseau, Pertes;Genie Electrique;TECH2;Pourquoi une grande partie de l'énergie produite est-elle perdue avant d'arriver ?;Optimisation du rendement global du réseau national.;Calcul des pertes par effet Joule et par effet couronne.;Logiciel de calcul de flux;Étude technico-économique de réseau.
653;Réalisation d'un gradateur de lumière triphasé pour éclairage scénique;Électronique Puissance, Éclairage;Genie Electrique;L3;Comment varier l'intensité de projecteurs puissants sans scintillement ?;Soutien aux infrastructures culturelles et événementielles.;Commande de l'angle de phase sur trois phases indépendantes.;Triacs, Opto-coupleurs;Gradateur de puissance industriel.
654;CONCEPTION ET REALISATION D'UNE PROTHÈSE ÉLECTRIQUE MANUELLE POUR PERSONNES HANDICAPÉES.;prothèse de main, prothèse électrique, capteurs, actionnement, assistance aux personnes handicapées;Genie Electrique;L3;Comment traduire des impulsions simples en mouvements mécaniques pour une prothèse accessible ?;Assistance au handicap et inclusion sociale;Mécanique articulée et asservissement;Servomoteurs, Arduino, Capteurs;Prototype de main artificielle motorisée pour les gestes quotidiens
655;Conception d'un banc de recharge pour véhicules électriques légers (vélos/motos);Énergie, Mobilité, Solaire;Genie Electrique;L3;Comment charger des batteries de mobilité sans surcharger le réseau local ?;Promotion de la mobilité durable et verte.;Station de charge solaire avec régulation de courant constante (CC/CV).;Panneaux PV, Régulateur;Borne de recharge solaire urbaine.
656;Étude de la protection différentielle des transformateurs de grande puissance;Électrotechnique, Protection;Genie Electrique;TECH2;Comment détecter un défaut interne au transformateur très rapidement ?;Protection des équipements les plus onéreux du poste électrique.;Comparaison des courants d'entrée et de sortie (Loi des nœuds).;Relais différentiel numérique;Étude de protection haute tension.
657;Réalisation d'un fréquencemètre numérique de précision (0.1Hz - 1MHz);Instrumentation, Électronique;Genie Electrique;L3;Comment mesurer avec exactitude la fréquence d'un signal électrique ?;Outil indispensable pour le dépannage électronique et la maintenance.;Comptage d'impulsions sur une fenêtre de temps calibrée.;Quartz, Microcontrôleur;Appareil de mesure numérique.
658;Conception d'un système de ventilation forcée automatisé pour transformateurs;Électricité, Thermique, Automatisme;Genie Electrique;L3;Comment augmenter la puissance d'un transformateur sans risque de fusion ?;Optimisation de la capacité de charge lors des pics de consommation.;Pilotage de ventilateurs en fonction de la sonde de température d'huile.;Sonde PT100, Relais;Système de refroidissement asservi.
659;Analyse de l'efficacité des filtres actifs face aux harmoniques de courant;Électronique Puissance, Qualité;Genie Electrique;TECH2;Comment dépolluer un réseau électrique perturbé par des onduleurs ?;"Amélioration de la ""propreté"" du courant et réduction des parasites.";Injection d'un courant compensateur en opposition de phase.;Filtre actif de puissance;Étude de dépollution harmonique.
660;Réalisation d'un dispositif de détection de rupture de phase pour moteurs triphasés;Sécurité, Électrotechnique;Genie Electrique;L3;Comment empêcher un moteur de griller si une seule phase du réseau est coupée ?;Protection du parc moteur industriel contre les avaries réseau.;Comparaison des tensions entre phases et coupure par contacteur.;Comparateurs, Relais;Relais de protection manque de phase.
661;Conception et développement d’un système de traduction en temps réel de la langue des signes en texte basé sur l’analyse vidéo par Open CV et l’apprentissage profond.;langue des signes, traduction en temps réel, analyse vidéo, OpenCV, apprentissage profond, Keras, TensorFlow;Genie Electrique;L3;Comment convertir les mouvements de la langue des signes en texte via une caméra ?;Facilitation de la communication pour malentendants;Traitement vidéo reconnaissance formes;Python, OpenCV, Médiapipe;Traducteur de signes en temps réel avec passerelle vers le Deep Learning (LSTM)
662;Conception d'un système d'alerte de dépassement de puissance souscrite;Électricité, Smart Meter;Genie Electrique;L3;Comment éviter les coupures automatiques et les amendes du fournisseur d'énergie ?;Maîtrise des coûts énergétiques pour les PME.;Mesure du courant en temps réel et avertisseur sonore/SMS avant le seuil.;Capteur SCT-013, ESP32;Système de gestion de la demande (Demand Response).
663;Réalisation d'un hacheur série (Buck Converter) pour l'alimentation de LED haute puissance;Électronique Puissance;Genie Electrique;TECH2;Comment abaisser une tension continue avec un rendement supérieur à 90% ?;Optimisation de l'éclairage basse consommation.;Commande PWM d'un transistor MOSFET et filtrage par inductance.;MOSFET, Diode de roue libre;Convertisseur DC-DC à haut rendement.
664;Étude et réalisation d'un détecteur d'incendie par analyse de fumée et de chaleur;Sécurité, Capteurs;Genie Electrique;L3;Comment réduire les fausses alertes tout en garantissant une détection précoce ?;Protection des entrepôts et des locaux techniques.;Corrélation des données entre un capteur optique (fumée) et une thermistance.;MQ-2, Arduino;Centrale d'alarme incendie intelligente.
665;Conception d'un système de synchronisation automatique pour deux groupes électrogènes;Électrotechnique, Réseau;Genie Electrique;L3;Comment coupler deux générateurs sur le même bus sans provoquer de court-circuit ?;Augmentation de la puissance disponible et continuité de service.;Contrôle de la fréquence, de la tension et de la phase (conditions de synchronisme).;Automate de couplage, Relais;Système de mise en parallèle de sources.
666;"""Conception d'une application mobile web fiable,rapide et sécurisé pour faciliter le vote de porte paroles des étudiants, de président facultaire et de chefs de promotion""";application mobile, application web, vote des étudiants, élection des représentants, sécurité des votes, rapidité, fiabilité;Genie Electrique;L3;Comment garantir l'intégrité et la transparence d'un scrutin étudiant via une plateforme mobile ?;Modernisation des processus électoraux et réduction des contestations;Développement Agile et sécurisation de données;React Native, Firebase, Authentification;Système de vote électronique sécurisé pour les élections étudiantes
667;Réalisation d'une station météo autonome pour l'optimisation des parcs solaires;Instrumentation, Solaire;Genie Electrique;L3;Comment corréler la production électrique avec l'irradiation réelle sur site ?;Évaluation précise de la performance (PR - Performance Ratio) des installations.;Mesure de l'irradiance (pyranomètre), température et vent.;Capteurs analogiques, Datalogger;Unité de mesure environnementale photovoltaïque.
668;Étude de l'influence du facteur de crête sur la précision des compteurs d'énergie;Électricité, Métrologie;Genie Electrique;TECH2;Les compteurs électroniques mesurent-ils correctement les courants très déformés ?;Équité de la facturation pour les clients industriels.;Comparaison entre compteurs classiques et analyseurs de réseau de classe A.;Analyseur Fluke, Shunt;Analyse de précision métrologique.
669;Conception d'un chargeur solaire avec algorithme MPPT (P&O);Énergie, Solaire, MPPT;Genie Electrique;TECH2;Comment extraire le maximum de puissance d'un panneau PV malgré les nuages ?;Amélioration du rendement de charge de 20 à 30% par rapport au PWM.;"Algorithme ""Perturb and Observe"" contrôlant un hacheur Buck.";Microcontrôleur, MOSFET;Régulateur de charge solaire intelligent.
670;Réalisation d'un système de protection de pompe contre la marche à sec;Hydraulique, Électricité;Genie Electrique;L3;Comment éviter que le moteur de pompe ne grille en cas de tarissement du puits ?;Protection des investissements hydrauliques ruraux.;Détection de sous-intensité ou utilisation de sondes de niveau conductrices.;Relais thermique, Sondes;Dispositif de sécurité pour forage.
671;Analyse du comportement thermique d'une armoire électrique sous forte charge;Électricité, Thermique;Genie Electrique;TECH2;Comment dimensionner la ventilation d'un TGBT pour éviter le déclenchement thermique ?;Fiabilisation des installations électriques de puissance.;Thermographie infrarouge et calcul des pertes par conduction/rayonnement.;Caméra thermique, Capteurs;Étude de dissipation thermique industrielle.
672;Conception d'un onduleur triphasé pour moteur asynchrone (MLI sinus);Électronique Puissance;Genie Electrique;L3;Comment transformer du 12V continu en triphasé 400V pour un moteur ?;Utilisation d'équipements triphasés sur batteries ou sites isolés.;Génération de trois signaux PWM déphasés de 120° et transformateur élévateur.;Pont en H triphasé, IR2110;Convertisseur DC-AC triphasé.
673;Réalisation d'un système de commande d'ascenseur pour un bâtiment de 3 étages;Automatisme, Logique;Genie Electrique;L3;Comment gérer les priorités d'appel et la sécurité des portes ?;Initiation aux systèmes de transport vertical et à la logique séquentielle.;Programmation d'un automate gérant les capteurs de fin de course et moteurs.;API ou Microcontrôleur, Relais;Maquette fonctionnelle d'ascenseur.
674;Étude et mise en œuvre d'un compensateur de creux de tension (DVR);Qualité Énergie;Genie Electrique;TECH2;Comment protéger une chaîne de production contre les baisses de tension brèves ?;Réduction des arrêts de production dans l'industrie sensible.;Injection d'une tension de compensation via un transformateur série.;Électronique de puissance;Stabilisateur dynamique de tension.
675;Conception et développement d'un système de vidéosurveillance intelligente basé sur la vision par ordinateur pour le renforcement de la sécurité dans les zones urbaines et rurales de la région des Grands Lacs (RDC);vidéosurveillance intelligente, vision par ordinateur, sécurité urbaine et rurale, région des Grands Lacs, détection automatique;Genie Electrique;L3;Comment détecter automatiquement des comportements suspects dans un flux vidéo en temps réel ?;Sécurisation des espaces publics et privés en milieu urbain;Traitement d images par bibliothèques open-source;Python, OpenCV, Raspberry Pi;Vidéosurveillance intelligente avec passerelle vers le Deep Learning
676;Conception d'un système d'arrosage automatique alimenté par énergie solaire;Agro, IoT, Solaire;Genie Electrique;L3;Comment automatiser l'irrigation d'un jardin sans accès au réseau électrique ?;Économie d'eau et autonomie complète du système.;Lecture de l'humidité du sol et pilotage d'une électrovanne 12V.;Capteur d'humidité, Panneau PV;Automate d'irrigation autonome.
677;Réalisation d'un ohmmètre de précision pour la mesure de faibles résistances;Instrumentation, Métrologie;Genie Electrique;L3;Comment mesurer précisément la résistance d'un contact ou d'un bobinage ?;Diagnostic de l'état des connexions et des enroulements de moteurs.;Utilisation de la méthode des 4 fils (Kelvin) pour éliminer la résistance des fils.;Amplificateur d'instrumentation;Appareil de mesure de milliohms.
678;Étude de la motorisation hybride pour petits bateaux de pêche;Électrotechnique, Marine;Genie Electrique;TECH2;Comment réduire la consommation de carburant en utilisant une assistance électrique ?;Réduction des coûts d'exploitation et de la pollution sonore marine.;Couplage entre moteur thermique et moteur électrique brushless.;Moteur BLDC, Contrôleur;Système de propulsion hybride.
679;Conception d'un système de gestion intelligente de l'éclairage d'un amphithéâtre;Domotique, Électricité;Genie Electrique;L3;Comment adapter l'éclairage selon la luminosité naturelle et l'occupation ?;Efficacité énergétique des bâtiments universitaires.;Gradation par bus DALI ou signal 0-10V asservie à des capteurs.;Capteur de luminosité, Triac;Contrôleur d'éclairage de zone.
680;Conception d'un modèle d'exosquelette de rééducation au niveau des jambes;exosquelette de rééducation, membres inférieurs, modélisation sous MATLAB, assistance à la marche, biomécanique;Genie Electrique;L3;Comment synchroniser les mouvements mécaniques avec l'intention de marche de l'utilisateur ?;Assistance à la rééducation motrice des personnes handicapées;Modélisation cinématique et asservissement;MATLAB, Servomoteurs, Capteurs EMG;Exosquelette de rééducation avec passerelle vers la commande neuronale
681;Réalisation d'un testeur automatique de continuité de câbles multi-brins;Maintenance, Électronique;Genie Electrique;L3;Comment vérifier rapidement le câblage d'un connecteur DB25 ou RJ45 ?;Gain de temps pour le câblage industriel et informatique.;Balayage séquentiel des broches et affichage des erreurs (croisement, coupure).;LED, Microcontrôleur;Outil de test de câblage.
