ID;thesis_title;thesis_keywords;student_faculty;student_level;Problématique;interet;Méthode;technologies;description_sujet
957;Conception d'un système d'acquisition de données météo par capteurs;IoT, Météo, Capteurs;Genie Electrique ;L3;Comment enregistrer et transmettre sans fil les variations météo ?;Surveillance environnementale pour l'agriculture de précision;Mise en réseau de capteurs I2C/One-Wire avec stockage SD;ESP32, Capteurs BME280, Module SD, C++;Passerelle M2 : Publication des données sur serveur web local
958;Réalisation d'un bras robotique trieur par reconnaissance de couleurs;Robotique, Vision, Automatisme;Genie Electrique ;L3;Comment automatiser le tri de pièces selon leur couleur ?;Modernisation des processus de tri dans les industries locales;Traitement du signal d'un capteur de couleur pour servomoteurs;Servomoteurs, Capteur TCS3200, Arduino Mega;Passerelle M2 : Interfaçage avec OpenCV pour vision caméra
959;Étude et réalisation d'un système de télésurveillance carburant par GSM;Télémétrie, GSM, Sécurité;Genie Electrique ;L3;Comment recevoir une alerte SMS en cas de vol de carburant ?;Lutte contre le vol dans les dépôts et groupes électrogènes;Mesure par ultrason et envoi de notifications via réseau mobile;Module SIM800L, Capteur US, Microcontrôleur;Dispositif de surveillance à distance avec alerte automatique SMS
960;Conception d'un indicateur de vitesse numérique pour moteur industriel;Tachymétrie, Vitesse, Interruption;Genie Electrique ;TECH2;Comment afficher avec précision la vitesse de rotation d'un arbre ?;Contrôle des processus mécaniques et maintenance préventive;Comptage d'impulsions via un capteur à effet Hall sur entrée d'interruption;Capteur Hall, Aimant, Microcontrôleur, Afficheur LCD;Tachymètre numérique programmable avec seuils d'alerte
961;Réalisation d'un régulateur de température PID piloté par PC;Régulation, PID, Interface;Genie Electrique ;L3;Comment obtenir une stabilité thermique parfaite via un logiciel ?;Précision pour les fours de laboratoire ou de bijouterie;Implémentation d'un algorithme PID avec monitoring graphique sur PC;Logiciel (Python/Processing), Arduino, Relais statique;Système de régulation thermique asservi par logiciel externe
962;Étude et conception d'un système d'alarme antivol à notification WiFi;Sécurité, WiFi, IoT;Genie Electrique ;TECH2;Comment être alerté sur son téléphone dès qu'un mouvement est détecté ?;Sécurisation des résidences et entrepôts de Goma;Utilisation d'un module WiFi pour envoyer une notification via API;NodeMCU (ESP8266), Détecteur PIR, Buzzer;Alarme connectée avec notification push sur smartphone
963;Réalisation d'une station de recharge solaire avec monitoring LCD;Solaire, Charge, Mesure;Genie Electrique ;TECH2;Comment afficher l'état de charge réel d'une batterie solaire ?;Information de l'utilisateur sur l'autonomie restante de son système;Interfaçage de capteurs de tension et courant avec un écran LCD;Écran LCD 16x2, Capteur INA219, Régulateur solaire;Chargeur intelligent avec affichage des paramètres en temps réel
964;Conception d'un système de contrôle de pH automatique pour piscicultures;Aquaculture, pH, Automatisme;Genie Electrique ;L3;Comment maintenir l'acidité de l'eau pour la survie des poissons ?;Amélioration du rendement des élevages de poissons locaux;Mesure du pH et activation automatique de pompes doseuses;Sonde pH, Électrode, Pompes péristaltiques, Arduino;Passerelle M2 : Enregistrement de l'historique de l'eau sur Cloud
965;Réalisation d'un synthétiseur de sons polyphonique simple;Audio, PWM, Signal;Genie Electrique ;TECH2;Comment générer des mélodies complexes à partir d'un microcontrôleur ?;Apprentissage du traitement numérique du signal audio de base;Génération de fréquences par modulation de largeur d'impulsion;Microcontrôleur, Amplificateur LM386, Haut-parleur;Instrument de musique électronique programmable
966;Étude et mise en place d'un système de pointage biométrique autonome;Biométrie, Personnel, Gestion;Genie Electrique ;L3;Comment automatiser le calcul du temps de présence des ouvriers ?;Lutte contre l'absentéisme et gestion simplifiée de la paie;Stockage des empreintes et horodatage sur mémoire EEPROM ou SD;Capteur d'empreintes, Module RTC (Horloge), Afficheur;Passerelle M2 : Synchronisation des pointages vers une base de données
967;Conception d'un contrôleur de ventilateur intelligent par capteur de CO2;Ventilation, Gaz, Santé;Genie Electrique ;TECH2;Comment évacuer l'air vicié d'une salle dès que le CO2 est trop élevé ?;Hygiène des espaces clos (salles de cinéma, salles de classe);Asservissement de la vitesse du ventilateur à la concentration de gaz;Capteur MQ-135, Ventilateur, Driver de puissance;Système de renouvellement d'air automatisé par détection de gaz
968;Réalisation d'un système de guidage automatique pour robot aspirateur;Robotique, Infrarouge, Évitement;Genie Electrique ;TECH2;Comment permettre à un robot de se déplacer sans heurter les obstacles ?;Base pour le développement de chariots automatisés en industrie;Algorithme d'évitement d'obstacles par capteurs de distance;Capteurs infrarouges/ultrasons, Châssis motorisé;Robot mobile autonome avec logique de navigation simple
969;Étude et conception d'une balance connectée avec transmission sans fil;Balance, Wireless, Agroalimentaire;Genie Electrique ;L3;Comment transmettre le poids d'une cargaison directement au bureau ?;Accélération du processus de pesage dans les entrepôts logistiques;Pont de Wheatstone interfacé avec un module radio RF ou WiFi;Jauge de contrainte, Amplificateur HX711, Module NRF24L01;Passerelle M2 : Intégration dans un système de gestion de stock
970;Réalisation d'un variateur de lumière tactile (Dimmer) sans contact;Domotique, Tactile, Capacitif;Genie Electrique ;TECH2;Comment varier l'éclairage par simple approche de la main ?;Design moderne et hygiène accrue (évite le contact physique);Détection de changement de capacité et gradation par Triac;Capteur capacitif TTP223, Optocoupleur, Triac;Interrupteur gradateur moderne pour éclairage intérieur
971;Conception d'un système de contrôle de charge pour voiture électrique miniature;Mobilité, Batterie, Monitoring;Genie Electrique ;TECH2;Comment gérer intelligemment la recharge d'un pack de batteries ?;Introduction aux technologies de batteries pour véhicules électriques;Surveillance thermique et équilibrage de charge via microcontrôleur;Capteurs de température, Relais, Chargeur intelligent;Unité de gestion de batterie (BMS) simplifiée pour maquette
972;Étude et mise en place d'un réseau de capteurs pour détection de fuite d'eau;Réseau, Eau, Alerte;Genie Electrique ;L3;Comment localiser une fuite d'eau dans un réseau de tuyauterie complexe ?;Réduction des pertes d'eau dans les infrastructures urbaines;Corrélation de données entre plusieurs capteurs de pression et débit;Capteurs de débit à effet Hall, ESP-NOW (Réseau sans fil);Passerelle M2 : Algorithme de localisation de fuite par analyse de flux
973;Réalisation d'un clavier MIDI pour la production musicale par ordinateur;Musique, USB, Interface;Genie Electrique ;TECH2;Comment utiliser des boutons physiques pour piloter un logiciel de musique ?;Création d'outils de production numérique à bas coût;Codage du protocole MIDI sur port USB à partir de boutons-poussoirs;Arduino Micro (ATmega32U4), Boutons, Potentiomètres;Contrôleur MIDI USB pour musiciens et producteurs
974;Conception d'un système de gestion de parking intelligent par détection;Parking, Capteur, Affichage;Genie Electrique ;TECH2;Comment afficher le nombre de places libres à l'entrée d'un parking ?;Fluidification du trafic urbain et confort des usagers;Détection de passage aux entrées/sorties et mise à jour d'un compteur;Barrière IR, Afficheur LCD géant, Microcontrôleur;Gestionnaire de places de stationnement automatisé
975;Réalisation d'une télécommande universelle programmable via smartphone;Infrarouge, Smartphone, App;Genie Electrique ;TECH2;Comment remplacer toutes les télécommandes IR par un seul boîtier WiFi ?;Centralisation du contrôle des équipements (TV, Clim, Radio);Capture des codes IR et réémission via une application web mobile;Émetteur/Récepteur IR, ESP8266, Interface Web HTML/JS;Hub infrarouge connecté pour domotique
976;Étude et réalisation d'un système de détection de faux billets par UV;Sécurité, Monétique, UV;Genie Electrique ;TECH2;Comment automatiser la détection de la fluorescence des billets ?;Sécurisation des transactions financières dans les commerces;Détection automatique par capteur de lumière UV lors de l'insertion;LED UV, Photodiode, Micro-moteur d'insertion;Détecteur électronique de contrefaçon monétaire
977;Conception d'un dispositif de télégestion pour éclairage public solaire;Solaire, Télégestion, Ville;Genie Electrique ;L3;Comment surveiller l'état des lampadaires solaires à partir de la mairie ?;Maintenance réactive et réduction des zones d'ombre en ville;Transmission de l'état des batteries par réseau longue portée (LoRa);Modules LoRa, Capteurs de tension, Gateway;Passerelle M2 : Cartographie temps réel de l'éclairage urbain
978;Réalisation d'un système d'arrosage automatique par prévision météo WiFi;Agriculture, API, WiFi;Genie Electrique ;L3;Comment éviter d'arroser si la pluie est prévue par la météo ?;Économie maximale d'eau et santé des plantes;Récupération des données météo en ligne (API) pour bloquer l'arrosage;ESP8266, API OpenWeatherMap, Électrovanne;Système d'irrigation prédictif intelligent
979;Étude d'un onduleur intelligent avec affichage de la distorsion harmonique;Qualité, Onduleur, FFT;Genie Electrique ;L3;Comment analyser la qualité de l'onde produite par un onduleur ?;Amélioration de la conception des onduleurs locaux;Traitement numérique du signal pour calculer le taux d'harmoniques (THD);Arduino, Écran graphique OLED, Capteur de tension;Passerelle M2 : Analyse spectrale temps réel du signal AC
980;Conception d'un gant traducteur de langue des signes en texte;Santé, Capteurs, Inclusion;Genie Electrique ;L3;Comment traduire les mouvements de la main en mots sur un écran ?;Inclusion sociale des personnes malentendantes à Goma;Mesure de la flexion des doigts et orientation par centrale inertielle;Capteurs de flexion, Accéléromètre, Écran LCD;Passerelle M2 : Transmission Bluetooth vers application mobile
981;Réalisation d'un système de sécurité par reconnaissance vocale simple;Audio, Sécurité, Reconnaissance;Genie Electrique ;L3;Comment commander une serrure par un mot de passe vocal ?;Sécurité mains libres pour zones sensibles;Extraction de caractéristiques audio et comparaison de modèles vocaux;Module VR (Voice Recognition), Microcontrôleur, Serrure;Passerelle M2 : Reconnaissance par réseau de neurones artificiels
982;Étude et mise en place d'un moniteur de consommation électrique par App;Énergie, IoT, Dashboard;Genie Electrique ;TECH2;Comment visualiser son coût d'électricité journalier sur son mobile ?;Sensibilisation à l'économie d'énergie pour les ménages;Mesure de puissance et envoi vers une plateforme IoT (Blynk/Adafruit);Capteur de courant non-invasif, ESP32, App Cloud;Compteur électrique connecté avec estimation de coût
983;Conception d'un contrôleur de vitesse pour tapis roulant avec arrêt d'urgence;Moteur, PWM, Sécurité;Genie Electrique ;TECH2;Comment réguler la vitesse d'un tapis tout en garantissant l'arrêt rapide ?;Application pour le sport (tapis de course) ou le transport de colis;Commande PWM pour moteur CC avec surveillance de bouton d'arrêt;Moteur CC, MOSFET, Encodeur rotatif;Système de commande motorisée avec boucle de sécurité logicielle
984;Développement d’une application mobile d’aide à la navigation basée sur un algorithme de la recherche opérationnelle pour la recherche du plus court chemin dans le centre-ville de Goma;application mobile, plus court chemin, algorithme graphe, navigation urbaine, Goma;Genie Informatique;TECH2;Comment optimiser les déplacements à Goma malgré les modifications imprévisibles de la voirie ?;Réduction du temps de trajet et de la consommation de carburant pour les usagers locaux.;Modélisation du réseau routier en graphe et implémentation de l'algorithme de Dijkstra.;Flutter, Google Maps API, Java/Kotlin.;Application de navigation calculant l'itinéraire le plus court entre deux points de la ville.
985;Application web de génération d'horaires des cours pour les écoles secondaires en RDC basée sur les LLMs;"génération horaires,LLM,intelligence artificielle,application web,éducation,RDC; optimisation planification,NLP";Genie Informatique;L3;Comment automatiser la gestion complexe des horaires scolaires en respectant les contraintes de l'EPSP ?;Suppression des conflits de locaux et d'enseignants dans les grandes institutions scolaires.;Programmation par contraintes et utilisation d'algorithmes génétiques pour l'ordonnancement.;Python (Django), React, Algorithmes génétiques.;Passerelle M2 : Système intelligent d'optimisation des ressources pédagogiques nationales.
986;Système Intelligent de Télésurveillance Médicale combinant IA, IoT et Blockchain;télésurveillance médicale,IA,IoT, Blockchain,e‑santé,système intelligent,sécurité données;Genie Informatique;TECH2;Comment assurer le suivi médical à distance tout en garantissant l'inviolabilité des données ?;Amélioration de la prise en charge des patients isolés et sécurisation des dossiers médicaux.;Interfaçage de capteurs bio-médicaux (IoT) avec une base de données décentralisée.;ESP32, Firebase, Solidity (Blockchain), React Native.;Prototype de monitoring vital avec stockage immuable des alertes critiques par Blockchain.
987;Mise en place et Etude de performance d’un système de diffusion audiovisuelle sur le web à la demande: Application à la plateforme NNP-Stream de NNP Sarl;diffusion audiovisuelle,streaming web,plateforme NNP‑Stream,Next.js,optimisation performance;Genie Informatique;L3;Comment garantir une diffusion vidéo fluide malgré l'instabilité de la bande passante locale ?;Optimisation des plateformes de streaming pour les médias numériques de Goma.;Analyse comparative des protocoles de streaming (RTMP vs HLS) et gestion de la mise en cache.;Next.js, Node.js, WebRTC, FFmpeg.;Passerelle M2 : Étude de l'adaptation dynamique du débit (ABR) selon la qualité réseau.
988;Conception et Développement d'une Application Mobile/Web pour l'Optimisation des Patrouilles de Sécurité Urbaine à Goma via l'Apprentissage par Renforcement et la Blockchain.;application mobile, application web, patrouilles de sécurité, Goma, apprentissage par renforcement, blockchain, optimisation des trajets, géolocalisation, sécurité urbaine, traçabilité;Genie Informatique;TECH2;Comment améliorer la réactivité des forces de sécurité face à l'insécurité urbaine ?;Meilleure couverture sécuritaire et dissuasion accrue par un routage intelligent des équipes.;Utilisation de la géolocalisation pour distribuer les patrouilles selon les zones de chaleur criminelle.;Android (Java), PHP (Laravel), MySQL.;Système de dispatching en temps réel pour la coordination des patrouilles de sécurité.
989;Conception et réalisation d’un système intelligent de recommandation de sujets de mémoire basé sur le profil académique des étudiants : Cas de la FSTA/ULPGL;système de recommandation, sujets de mémoire, profil académique, FSTA, ULPGL, Goma, intelligence artificielle, apprentissage automatique, système intelligent;Genie Informatique;L3;Comment guider les étudiants vers des sujets originaux adaptés à leurs compétences réelles ?;Amélioration de la qualité scientifique et réduction de la redondance des travaux à l'ULPGL.;Implémentation d'un moteur de recommandation basé sur le filtrage collaboratif et le NLP.;Python (Scikit-learn), Flask, PostgreSQL.;Passerelle M2 : Analyse sémantique des propositions pour vérifier l'originalité du sujet proposé.
990;SOLUTIONS DE SECURITE POUR LES  SYSTEMES DOMOTIQUE;systèmes domotiques, sécurité des systèmes, contrôle d’accès, surveillance, maison intelligente, réseau domestique;Genie Informatique;TECH2;Comment protéger une maison intelligente contre le piratage des commandes à distance ?;Garantie de la confidentialité et de la sécurité physique des occupants des maisons connectées.;Mise en œuvre de couches de chiffrement et d'authentification multi-facteurs (MFA).;Raspberry Pi, Python, Zigbee, AES.;Dispositif de cybersécurité pour les réseaux IoT résidentiels contre les intrusions numériques.
991;Conception architecturale d’un système intelligent pour l’assistance au diagnostic des maladies tropicales à partir d’images médicales;diagnostic médical, maladies tropicales, images médicales, apprentissage profond, intelligence artificielle, système d’aide à la décision;Genie Informatique;TECH2;Comment assister le personnel soignant rural dans le diagnostic rapide des maladies endémiques ?;Réduction du taux de mortalité par un dépistage précoce via l'intelligence artificielle.;Entraînement d'un modèle de vision par ordinateur pour la classification d'images médicales.;Python, TensorFlow, OpenCV.;Outil d'aide à la décision médicale basé sur l'analyse automatisée de prélèvements.
992;Conception et implémentation d'une application web participative de signalement des incidents sécuritaires à Goma basée sur la géolocalisation;application web, signalement d’incidents, géolocalisation, Goma, sécurité urbaine, participation citoyenne, système d’information géographique;Genie Informatique;L3;Comment accélérer l'intervention des services d'urgence grâce à la participation citoyenne ?;Amélioration de la gestion des crises urbaines (incendies, éboulements, fuites d'eau).;Création d'une plateforme de crowdsourcing avec validation de données géolocalisées.;MERN Stack (MongoDB, React, Node).;Passerelle M2 : Clustering spatial des alertes pour l'analyse des risques majeurs.
993;"""Conception et mise en œuvre d’un système IoT pour le contrôle intelligent et la surveillance optimisée d’une habitation"".";système IoT, maison intelligente, capteurs, Arduino, ESP32, contrôle à distance, surveillance, sécurité, réseau Wi‑Fi;Genie Informatique;L3;Comment réduire le gaspillage électrique tout en sécurisant son domicile à distance ?;Économie d'énergie pour les ménages et surveillance proactive contre les cambriolages.;Développement d'une architecture client-serveur réactive basée sur le protocole MQTT.;ESP32, MQTT, Flutter (App mobile).;Passerelle M2 : Intégration d'un module d'IA pour l'optimisation prédictive de la consommation.
994;Conception et réalisation d'un système de vote électronique utilisant l'internet des objet et la vision par ordinateur;vote électronique, internet des objets, vision par ordinateur, sécurité des votes, application web, authentification;Genie Informatique;L3;Comment restaurer la confiance dans les scrutins en automatisant le comptage et l'identification ?;Transparence électorale et réduction drastique des contestations post-électorales.;Identification biométrique (vision) couplée à un comptage numérique sécurisé (IoT).;Python, OpenCV, Raspberry Pi, MySQL.;Passerelle M2 : Sécurisation du registre de vote par une architecture distribuée décentralisée.
995;Conception et implémentation d'un système domotique pour un laboratoire informatique.;domotique, laboratoire informatique, automatisation, Arduino, contrôle des équipements, sécurité des locaux;Genie Informatique;L3;Comment automatiser la gestion des équipements informatiques pour prolonger leur durée de vie ?;Réduction des coûts de maintenance et protection du matériel contre les surchauffes.;Centralisation du contrôle des prises et de l'éclairage via une interface logicielle locale.;Arduino, Relais, C#, Protocole Firmata.;Passerelle M2 : Monitoring automatique des conditions physiques lié à la charge serveur.
996;CONCEPTION ET REALISATION D’UN TRADUCTEUR DE TEXTE MULTILANGUE BASE SUR  L'INTELLIGENCE ARTIFICIELLE;traduction automatique, texte multilingue, intelligence artificielle, traitement du langage naturel, réseau de neurones;Genie Informatique;L3;Comment briser la barrière linguistique entre le langage technique et les langues vernaculaires ?;Inclusion numérique et facilitation de l'apprentissage pour les populations locales.;Utilisation de modèles de traitement du langage naturel (Transformers) pour la traduction.;Python, PyTorch, Hugging Face.;Passerelle M2 : Fine-tuning d'un modèle de langage spécifique au Swahili de l'Est (Goma).
997;Conception et développement d'une application web de suivi de l'évolution des documents administratifs au sein d'une Université : Cas de l'ULPGL/Goma;application web, suivi des documents, gestion administrative, ULPGL Goma, numérisation, PHP, JavaScript;Genie Informatique;L3;Comment automatiser le suivi des étapes de validation d'un dossier pour éviter les pertes à l'ULPGL Goma ?;Fluidification des processus administratifs et réduction des déplacements inutiles des étudiants.;Modélisation des processus métier (BPMN) et implémentation d'un système de notifications.;PHP (Laravel), MySQL, JavaScript.;Passerelle M2 : Système de workflow intelligent avec archivage numérique légal.
998;Conception et réalisation d'une application web pour la vente de propriétés immobilières;application web, vente de propriétés immobilières, base de données MySQL, PHP, annonces immobilières;Genie Informatique;L3;Comment sécuriser les transactions immobilières et garantir la fiabilité des offres dans la ville de Goma ?;Centralisation des offres et lutte contre les escroqueries foncières locales.;Développement d'une plateforme d'annonces avec module de vérification documentaire.;ReactJS, Node.js, MongoDB, Google Maps API.;Passerelle Civil : Intégration de données cadastrales pour la gestion urbaine.
999;Conception et optimisation d'un mini sous marin autonome pour l'exploitation sous marine cas du lac kivu; mini sous‑marin, véhicule sous‑marin autonome, lac Kivu, exploration sous‑marine, SolidWorks, génie mécanique;Genie Informatique;L3;Comment concevoir un algorithme de navigation autonome capable de résister aux courants du lac Kivu ?;Exploration des fonds marins et surveillance des infrastructures de gaz méthane.;Algorithmique de commande prédictive et fusion de données de capteurs.;Python (ROS), Arduino, C++, SolidWorks.;Passerelle Élec : Prototype de drone sous-marin pour l'inspection technique.
1000;Conception d’une application web pour une optimisation des rendez-vous dans un salon de beauté : cas du salon Benkip/Goma;application web, gestion de rendez‑vous, salon de beauté Benkip, optimisation du planning, interface utilisateur;Genie Informatique;L3;Comment réduire le temps d'attente des clients et optimiser l'agenda des employés du salon Benkip ?;Amélioration de la satisfaction client et gestion optimale des ressources humaines.;Utilisation d'un algorithme d'ordonnancement pour la gestion des créneaux horaires.;Python (Django), PostgreSQL, Vue.js.;Passerelle M2 : Module de prédiction d'affluence basé sur l'historique des visites.
1001;Conception et réalisation d'un système intelligent d'apprentissage adaptatif et optimisé pour la préparation aux examens sur plateformes mobiles et web : Approche hybride basée sur les LLMs;système d’apprentissage adaptatif, préparation aux examens, plateformes web et mobiles, grands modèles de langage, intelligence artificielle, personnalisation;Genie Informatique;L3;Comment personnaliser le parcours pédagogique d'un élève en fonction de ses erreurs ?;Augmentation du taux de réussite aux examens d'État par un renforcement ciblé.;Implémentation d'un moteur de recommandation basé sur l'intelligence artificielle.;Python, TensorFlow, Flutter, Firebase.;Passerelle M2 : Système expert analysant les styles d'apprentissage des utilisateurs.
1002;INFLUENCE DES APPLICATIONS DE MOBIL MARKETING SUR LE COMPORTEMENT D’ACHAT DES CLIENTS : Cas des PME de Goma;marketing mobile, applications mobiles, comportement d’achat des clients, PME de Goma, campagnes promotionnelles;Genie Informatique;L3;Comment quantifier et analyser l'impact réel des notifications push sur les ventes des PME à Goma ?;Aide à la décision pour les entrepreneurs locaux sur l'efficacité de leur stratégie.;Analyse de données (Data Analytics) et développement d'un outil de tracking.;Python (Pandas), SQL Server, Power BI.;Passerelle M2 : Analyse de sentiments pour prédire les tendances d'achat.
1003;Conception et réalisation d'un système de suivi de la transmission des documents administratives entre le décanat facultaire et l'administration centrale d'une université : Cas de l'ULPGL/ Goma.;système de suivi, transmission des documents administratifs, décanat et administration centrale, ULPGL Goma, traçabilité en temps réel;Genie Informatique;L3;Comment garantir la traçabilité physique et numérique des documents entre les bureaux du décanat ?;Sécurisation des flux d'information et preuve de réception des courriers.;Utilisation de la technologie QR Code pour marquer chaque document lors de sa transmission.;Java, Spring Boot, MySQL, QR API.;Passerelle M2 : Intégration de la signature électronique pour la validation.
