ID;thesis_title;thesis_keywords;student_faculty;student_level;Problématique;interet;Méthode;technologies;description_sujet
286;Étude des performances préventives des stations et réservoirs d'essence visible sur le catastrophe volcanique de Goma;risque volcanique, réservoirs pétroliers, prévention, sécurité industrielle, goma;Genie civil;TECH2;"""Comment évaluer et renforcer les dispositifs de sécurité des stations-service pour prévenir les risques d'explosion et de pollution lors d'une coulée de lave à Goma ?""";Sécuriser le stockage des hydrocarbures face à l aléa;Analyse de vulnérabilité thermique et barrières de protection;Logiciel de simulation Labo;Étude des dispositifs de confinement des réservoirs d essence
287;Étude comparative technico-économique et de la résistance d'une structure en béton armé et une structure métallique : application sur un entrepôt en béton armé et un hangar en métal;béton armé, structure métallique, analyse comparative, résistance mécanique, économie;Genie civil;TECH2;"""Quelle variante structurelle offre le meilleur compromis entre coût global et rapidité d'exécution pour un entrepôt industriel à Goma ?""";Optimiser l investissement pour les structures industrielles;Analyse technico économique du cycle de vie;MS Project SAP2000;Comparaison de la rapidité d exécution et de la durabilité
288;Analyse dynamique et statique d'une poutre en arc supportant une plaque en béton armé dans l'hypothèse des poutres travaillant comme des poteaux : application à une salle de fête;analyse dynamique, analyse statique, poutre en arc, béton armé, structure spéciale;Genie civil;TECH2;"""Comment le comportement vibratoire et la répartition des efforts varient-ils dans une poutre en arc sous l'effet de charges permanentes et mobiles ?""";Franchir de larges volumes avec une esthétique structurale;Analyse statique et dynamique sous charges variables;SAP2000 Robot Structural;Modélisation du comportement vibratoire d un arc en béton armé
289;Étude de la connexion de cisaillement  dans les poutres mixtes bois-béton;poutres mixtes, bois-béton, connexion de cisaillement, structure composite;Genie civil;TECH2;"""Comment dimensionner les connecteurs pour assurer un transfert de cisaillement efficace et éviter le glissement à l'interface bois-béton ?""";Rénover ou construire léger avec des structures mixtes;Calcul des connecteurs de cisaillement et de glissement;Cadwork Robot Structural;Analyse du transfert d efforts dans un plancher hybride performant
290;Étude géotechnique en vue de la stabilisation des sols sur la route de bweremana vers bitonga par la chaud.;géotechnique routière, stabilisation des sols, bweremana, génie routier;Genie civil;TECH2;"""Dans quelle mesure l'apport de chaux modifie-t-il les limites d'Atterberg et la portance des sols argileux de Bweremana pour un usage routier ?""";Améliorer durablement la voirie rurale de Bweremana;Étude des limites d Atterberg et de la portance;Pénétromètre Essai Proctor;Comparaison de l efficacité des liants sur les sols argileux
291;Etude d’une plateforme fixe d’extraction du pétrole dans le lac Albert;plateforme pétrolière, offshore, extraction pétrolière, lac albert;Genie civil;TECH2;"""Comment assurer la stabilité d'une plateforme fixe face aux sollicitations hydrodynamiques et au poids des équipements d'extraction ?""";Exploiter les ressources énergétiques en milieu offshore;Calcul de structure fixe face aux houles et courants;SACS Midas Civil;Analyse de stabilité hydrodynamique d une tour d extraction
292;Étude technico-économique d'une structure R+5 en béton armée à usage d'habitation cas d'un bâtiment de logement des professeurs encadreurs de L'ULPGL Goma campus Salomon;béton armé, structure r+5, étude technico-économique, bâtiment résidentiel, ulpgl;Genie civil;TECH2;"""Comment optimiser le ferraillage et les sections de béton pour un R+5 afin de réduire les coûts sans compromettre la sécurité structurelle ?""";Optimiser le ratio acier béton pour réduire les coûts;Dimensionnement itératif et plans d exécution béton;Robot Structural Revit;Étude structurale d un logement pour enseignants au campus Salomon
293;Étude architecturale et structurale d'une ossature métallique en voute : application sur un centre commercial à Goma;ossature métallique, voûte, centre commercial, analyse architecturale et structurale;Genie civil;TECH2;"""Comment dimensionner une charpente métallique en voûte pour franchir de larges espaces tout en garantissant la stabilité au déversement ?""";Concevoir un centre commercial iconique à Goma;Calcul de charpente en voûte pour libérer l espace au sol;Advance Steel SAP2000;Analyse de la stabilité au flambement des arcs métalliques
294;Étude de faisabilité d’une ligne ferroviaire reliant Goma-Butembo;ligne ferroviaire, étude de faisabilité, transport ferroviaire, goma-butembo;Genie civil;TECH2;"""Quels sont les défis techniques majeurs liés à la pente et à la stabilité des remblais pour l'implantation d'une voie ferrée dans le relief du Kivu ?""";Connecter les pôles économiques du Nord Kivu;Étude de tracé en relief montagneux et stabilité des remblais;Civil 3D Mensura;Analyse de faisabilité technique pour le franchissement des zones à forte pente
295;Adaptation des constructions écologiques en milieu parasismique : cas de la ville de Goma;construction écologique, parasismique, durabilité, architecture verte, goma;Genie civil;TECH2;"""Comment concilier l'usage de matériaux durables et de techniques bioclimatiques avec les exigences strictes du calcul parasismique à Goma ?""";Allier durabilité environnementale et sécurité vitale;Conception bioclimatique et calcul de structure bois terre;ArchiCAD Robot Structural;Adaptation des matériaux locaux aux exigences de la zone sismique de Goma
296;Conception parasismique des structures équipées des systèmes d’isolation sismique: Application aux bâtiments en béton-armé vulnérables face aux effets du séisme;isolation sismique, analyse dynamique, béton armé, génie parasismique;Genie civil;TECH2;"""Quelle est l'efficacité des appuis isolateurs pour réduire l'accélération transmise à la structure d'un bâtiment lors d'un séisme à Goma ?""";Protéger les bâtiments vulnérables contre la ruine totale;Analyse dynamique avec insertion d appuis élastomères;SeismoStruct SAP2000;Étude de l atténuation de l accélération transmise à la structure
297;"Etude de l’influence de l’angle de frottement interne du sol sur le dimensionnement des fondations superficielles.
Cas des semelles isolées et filantes d’une structure R+3";fondations superficielles, frottement interne, mécanique des sols, dimensionnement;Genie civil;TECH2;"""De quelle manière la variation des paramètres de cisaillement du sol influence-t-elle le dimensionnement et le tassement des semelles isolées ?""";Optimiser les dimensions des fondations en zone instable;Analyse de sensibilité des paramètres de cisaillement du sol;Plaxis Géo Slope;Influence de la variation du sol sur le tassement d un immeuble R+3
298;INFLUENCE DES ISOLATEURS DE BASE SUR LA REPONSE DYNAMIQUE DES BÂTIMENTS : application sur un bâtiment R+5 dans la ville de Goma;isolation de base, réponse dynamique, séisme, structure r+5;Genie civil;TECH2;"""Comment l'installation d'isolateurs à la base modifie-t-elle les modes de vibration et les efforts de cisaillement d'un bâtiment R+5 ?""";Garantir la continuité d activité après un séisme majeur;Modélisation de la réponse dynamique temporelle;ETABS SAP2000;Comparaison du comportement avec et sans isolation à la base
299;Étude de l'influence de la hauteur sur la réponse sismique des structures en béton armé : application aux bâtiments de la ville de Goma;béton armé, réponse sismique, hauteur des bâtiments, analyse dynamique;Genie civil;TECH2;"""Comment le nombre d'étages d'un bâtiment en béton armé impacte-t-il sa période propre et sa vulnérabilité face aux ondes sismiques de Goma ?""";Comprendre la vulnérabilité des immeubles élancés à Goma;Analyse modale et étude des périodes propres du bâtiment;Robot Structural ETABS;Influence du nombre d étages sur l amplification des efforts sismiques
300;Etude structurale d’un immeuble d’habitation R+5 en bois dans un milieu sismique. Application dans la ville de Goma.;structure bois, bâtiment r+5, milieu sismique, analyse structurale;Genie civil;TECH2;"""Le bois peut-il offrir une meilleure réponse dynamique qu'une structure béton pour un R+5 en zone sismique tout en restant économique ?""";Proposer une alternative légère et résiliente au béton;Calcul de structure bois multi étagée sous charges latérales;Cadwork Robot Structural;Analyse de la stabilité d une ossature bois en zone de forte sismicité
301;ÉTUDE DU BIOBETON ET SA CAPACITÉ À ABSORBER LES FISSURES;biobéton, fissuration, auto-cicatrisation, matériaux innovants;Genie civil;TECH2;"""Comment l'activité bactérienne au sein du biobéton permet-elle de refermer les micro-fissures et d'améliorer l'étanchéité des structures ?""";Réduire les coûts de maintenance des structures fissurées;Étude de l activité bactérienne pour le colmatage des fissures;Microscope Labo Matériaux;Évaluation de l étanchéité et de la reprise de résistance du bio béton
302;ÉTUDE D'UN SILO A GRAIN EN BÉTON ARMÉ;silo à grain, béton armé, stockage agricole, dimensionnement structural;Genie civil;TECH2;"""Comment dimensionner les parois d'un silo pour résister à la poussée hydrostatique des grains et aux effets de vidange ?""";Sécuriser le stockage agricole et la sécurité alimentaire;Calcul de pression hydrostatique des grains et effets de vidange;SAP2000 Robot Structural;Dimensionnement des parois circulaires face aux poussées dynamiques
303;Conception et Dimensionnement d'une caserne des Sapeurs-pompiers dans la commune de Karisimbi;caserne de pompiers, béton armé, conception structurale, sécurité civile;Genie civil;L3;Quelle structure permet d'accueillir des véhicules lourds avec un déploiement ultra-rapide ?;Amélioration de la sécurité civile et des secours;Analyse structurelle et descente de charges;Béton armé, Robot Analysis;Étude de génie civil pour une caserne de pompiers moderne
304;ÉTUDE COMPARATIVE TECHNICO-ECONOMIQUE ENTRE L'APPLICATION DE LA NORME BAEL 91 MODIFIÉ 99 ET L'EUROCODE 2 DANS LE CALCUL DES OUVRAGES EN BA: Application sur un bâtiment R+10 avec parking souterrain à usage de bureaux à Goma.;bael 91, eurocode 2, béton armé, analyse comparative, bâtiment r+10;Genie civil;TECH2;"""Quelles sont les différences significatives en termes de ratios d'acier et de sécurité obtenues lors du calcul d'un R+10 selon les deux normes ?""";Optimiser les ratios d acier par l usage des normes modernes;Analyse comparative du ferraillage et des coefficients de sécurité;Robot Structural Eurocodes;Impact économique et sécuritaire du passage aux normes européennes
305;ETUDE COMPARATIVE DE LA RÉSISTANCE À LA COMPRESSION DES PAVÉS EN PIERRES VOLCANIQUES TAILLEES ET EN BÉTON. Cas du tronçon entrée Hôtel Boneza-Musée;pavés, pierres volcaniques, résistance à la compression, chaussée urbaine;Genie civil;L3;Les pavés en pierre volcanique offrent-ils une résistance comparable au béton ?;Valorisation des matériaux locaux de Goma;Essais mécaniques comparatifs en labo;Pierre volcanique, RDM;Analyse scientifique de la durabilité des revêtements routiers locaux
306;Etude de l'influence de la qualité de l'eau sur la prise du ciment: case de l'eau du la lac kivu et l'eau de pluie;prise du ciment, qualité de l’eau, lac kivu, matériaux de construction;Genie civil;L3;"""Quels sont les effets de la minéralisation de l'eau du Lac Kivu sur le temps de prise et la cristallisation des hydrates du ciment ?""";Comprendre l impact de la minéralisation sur les chantiers;Étude chimique et tests de cristallisation des hydrates;Appareil Vicat Labo;Influence de l eau lacustre sur le temps de prise et la durabilité du béton
307;Aménagement d’une chaussée routière en béton bitumineux (Application sur le tronçon Cajed-Station amani jm drc);chaussée bitumineuse, dimensionnement routier, génie routier;Genie civil;L3;Comment dimensionner la chaussée pour résister au trafic lourd sur l'axe Goma-Sake ?;Pérennisation des routes et flux économique;Méthode CBR et dimensionnement multicouche;Bitume, Géotechnique, Routier;Projet d'asphaltage du tronçon Mugunga incluant l'étude de sol
308;ÉTUDE D’UN SYSTÈME DE DRAINAGE D’EAUX PLUVIALES STAGNANTES SUR L’AXE ROUTIER Alexandre MAHAMBA dans la ville de GOMA;drainage urbain, eaux pluviales, assainissement, voirie urbaine;Genie civil;L3;Comment concevoir un drainage sur route à pente complexe pour éviter la stagnation ?;Protection de la chaussée et hygiène publique;Relevé topographique et calcul hydraulique;Topographie, Assainissement;Solution d'évacuation des eaux pour l'axe routier Alphajiri
309;Conception et réalisation d'une centrale d'éclairage électronique;éclairage électronique, conversion d’énergie, électronique appliquée;Genie civil;L3;"""Comment concevoir un système de conversion d'énergie efficace pour assurer l'alimentation autonome et sécurisée des dispositifs d'éclairage d'un bâtiment ?""";Assurer l autonomie énergétique des infrastructures;Conception de système de conversion et stockage d énergie;Matlab Simulink Proteus;Étude d un dispositif de gestion d énergie pour bâtiments publics
310;"Conception et dimensionnement d'un bâtiment R+2 servant de maison de passage à GOMA : ""cas du quartier Mapendo"".";maison de passage, bâtiment r+2, béton armé, conception structurale;Genie civil;L3;"""Comment optimiser l'organisation spatiale et la descente de charges d'un bâtiment R+2 pour répondre aux besoins de transit dans un quartier urbain dense ?""";Améliorer l offre de logement temporaire au centre ville;Descente de charges et optimisation de l espace habitable;AutoCAD Robot Structural;Étude structurale et fonctionnelle d un bâtiment d accueil urbain
311;INFLUENCE DE LA PERFORMANCE DES JOINTS PARASISMIQUES SUR LES STRUCTURES DES FORMES IRRÉGULIÈRES EN L DANS LA VILLE DE GOMA: APPLICATION À UNE STRUCTURE R+3 SERVANT DE BÂTIMENT D’ÉTABLISSEMENT SCOLAIRE;joints parasismiques, structures irrégulières, génie parasismique;Genie civil;TECH2;"""Comment dimensionner les joints de rupture pour éviter l'entrechoquement des ailes d'un bâtiment en L lors d'une sollicitation sismique majeure ?""";Éviter l entrechoquement des ailes de bâtiments complexes;Analyse des déplacements horizontaux et dimensionnement du vide;ETABS SAP2000;Étude du comportement de structures irrégulières sous séisme à Goma
312;Conception et dimensionnement d'une construction en bois avec isolation thermique, cas d'une maison d'habitation.;structure bois, isolation thermique, maison d’habitation, construction durable;Genie civil;L3;Comment assurer la stabilité du bois tout en garantissant un confort thermique passif ?;Promotion de l'habitat durable et écologique;Calcul structurel et bilan thermique;Bois CLT, Isolants, Revit;Construction bois isolée avec passerelle vers la simulation thermique
313;CONCEPTION ET ETUDE D’UN CIRCUIT DE PROTECTION CONTRE LES SUR TENSIONS TRIPHASEES;protection électrique, surtensions, électronique de puissance;Genie civil;L3;"""Comment réaliser un dispositif de protection robuste pour préserver les équipements industriels contre les variations brutales de tension du réseau électrique ?""";Préserver les équipements industriels des pics de tension;Conception d un circuit de protection et de filtrage;ETAP Proteus;Réalisation d un dispositif robuste contre les variations du réseau
314;Étude comparative des comportements mécaniques des béton formulé à base des graviers tout venant et ciments courant dans la ville de Goma.;béton, graviers locaux, propriétés mécaniques, matériaux de construction;Genie civil;TECH2;"""Quelle est l'incidence de la forme et de la texture des granulats locaux sur l'adhérence pâte-granulat et la résistance finale à la compression du béton ?""";Réduire le coût du béton par l usage de matériaux bruts;Analyse de l adhérence et de la résistance finale du mélange;Presse béton Labo;Étude expérimentale de la fiabilité des bétons formulés sans concassage
315;Caractérisation des granulats de BIHAMBWE/MASISI en vue d'une bonne utilisation dans la confection des bétons.;granulats, bihambwe, caractérisation, béton, matériaux locaux;Genie civil;TECH2;"""Quelles sont les propriétés physiques et mécaniques des granulats de Bihambwe et leur aptitude à être utilisés dans la confection des bétons de haute résistance ?""";Valoriser les ressources de Masisi pour le béton de structure;Caractérisation physique et essais de résistance mécanique;Machine Los Angeles Labo;Évaluation de l aptitude des granulats locaux à la confection de bétons durables
316;"Étude du comportement mécanique du béton par substitution partielle du ciment par la Chaux avec les concassés et les roulés

Cas d'une maison d'habitation";béton, chaux, substitution partielle, comportement mécanique;Genie civil;TECH2;"""Dans quelle mesure l'incorporation de la chaux modifie-t-elle l'ouvrabilité du béton frais et sa capacité de déformation sous charge par rapport à un béton témoin ?""";Améliorer la maniabilité des bétons à base de sable de rivière;Analyse de la rhéologie et de la déformabilité sous charge;Cône d Abrams Presse;Étude de l influence de la chaux sur la cohésion du mélange frais
317;Etude de l'influence du taux d'absorption  d'eau des graviers  concassés  et de sable roulé  sur le dossage en eau  du béton.;absorption d’eau, granulats, béton, formulation;Genie civil;TECH2;"""Comment ajuster le ratio eau/ciment en fonction de la porosité des granulats volcaniques de Goma pour garantir la maniabilité sans sacrifier la résistance ?""";Maîtriser le dosage en eau pour garantir la résistance;Étude de la porosité et ajustement du rapport E C;Balance hydrostatique Labo;Optimisation de la formulation du béton selon la porosité des granulats volcaniques
318;ETUDE STRUCTURALE ET ÉCONOMIQUE D'UN BARRAGE D'UNE CENTRALE HYDROÉLECTRIQUE. CAS DE LA CENTRALE HYDROÉLECTRIQUE DE RWANGUBA;barrage hydroélectrique, analyse structurale, retenue d’eau;Genie civil;TECH2;"""Comment dimensionner l'ouvrage de retenue pour assurer sa stabilité sous la poussée hydrostatique tout en optimisant les coûts de construction en béton armé ?""";Garantir la sécurité énergétique par une structure hydro-résistante;Analyse structurale et calcul de poussée hydrostatique;ANSYS Robot Structural;Dimensionnement de l ouvrage de retenue et stabilité au glissement
319;DU CONTROLE DE L'EXECUTION DU BUDJET;gestion budgétaire, contrôle financier, administration;Genie civil;TECH2;"""Comment optimiser les mécanismes de contrôle pour garantir la transparence et l'efficacité de l'allocation des ressources budgétaires ?""";Optimiser la gestion financière des grands projets de BTP;Audit des coûts et mécanismes de transparence financière;MS Project Primavera;Analyse de l efficience de l allocation des ressources sur chantier
320;Conception et dimensionnement d’un bâtiment R+1en béton armé pouvant servir d’un orphelinat en ville de Goma;orphelinat, béton armé, bâtiment r+1, conception structurale;Genie civil;L3;Quelle configuration structurelle garantit la sécurité pour une infrastructure sociale ?;Soutien aux populations vulnérables;Descente de charges et étude de ferraillage;Béton armé, Robot Analysis;Étude de génie civil pour un centre d'accueil sécurisé
321;Conception et dimensionnement d'un bâtiment à ossature bois servant de salle de spectacle dans la ville de Goma;ossature bois, salle de spectacle, conception structurale;Genie civil;L3;"""Comment dimensionner une charpente bois de grande portée pour assurer l'acoustique et la stabilité d'une salle de spectacle ?""";Offrir une acoustique supérieure par une charpente biosourcée;Calcul de charpente bois de grande portée;Cadwork Robot Structural;Conception d un espace culturel avec optimisation de la visibilité
322;"Etude comparative de l'amenagement d'une route en terre et en pavée de Roche Basaltique;Application sur le tronçon Kanisa la Mungu-deux lampes";chaussée routière, pavés basaltiques, aménagement routier;Genie civil;L3;"""Quelle solution entre la terre stabilisée et le pavé basaltique offre la meilleure résistance aux charges de trafic urbain à Goma ?""";Choisir le revêtement optimal pour la voirie urbaine;Comparaison de portance et de durabilité;Pénétromètre Essai Proctor;Étude de la résistance aux charges de trafic entre sol stabilisé et pavé basaltique
323;Dimensionnement des éléments de structure d'un stade de basket-ball à Mubambiro;stade de basketball, béton armé, bois, dimensionnement;Genie civil;L3;"""Comment dimensionner les éléments porteurs en béton armé pour garantir la stabilité d'une structure de grande portée destinée à un stade de basket-ball à Mubambiro ?""";Développer le sport local par des infrastructures modulaires;Descente de charges et calcul de portiques mixtes;AutoCAD Robot Structural;Dimensionnement des éléments porteurs pour une structure de 1500 places
324;Étude des effets dynamiques sur des structures avec parking souterrain à MINOVA Cas d'un bâtiment en béton armé R+9;effets dynamiques, parking souterrain, béton armé;Genie civil;TECH2;"""Comment assurer la stabilité d'un parking en béton armé face aux sollicitations dynamiques et aux contraintes du sol à Minova ?""";Sécuriser les parkings souterrains en zone de forte pente;Analyse de l interaction sol structure sous charge mobile;Plaxis ETABS;Étude de la stabilité d un parking R+9 face aux poussées latérales du sol
325;Analyse de l'impact et solutions des armatures provenant des aciers recyclés dans la construction des ouvrages d'arts.;acier recyclé, armatures, ouvrages d’art, durabilité;Genie civil;TECH2;"""Quelle est l'influence de l'utilisation d'aciers recyclés sur la ductilité et la durabilité structurelle d'un pont en béton armé ?""";Favoriser l économie circulaire dans les infrastructures;Analyse de ductilité et de résistance à la fatigue des armatures;Machine d essais traction Labo;Étude de la durabilité des ponts construits avec des aciers de réemploi
326;"Étude comparative de deux systèmes de contreventement pour l'amortissement des effets dynamiques : ""cas d'un bâtiment commercial R+7 à GOMA""";contreventement, amortissement dynamique, bâtiment r+7;Genie civil;TECH2;"""Quel système de contreventement offre la meilleure dissipation d'énergie pour un bâtiment R+7 soumis à des charges horizontales ?""";Limiter les oscillations des bâtiments commerciaux à Goma;Analyse de la dissipation d énergie;SAP2000 ETABS;Comparaison de deux systèmes de contreventement pour le confort des usagers
327;Conception et dimensionnement d'un entrepôt des pommes de terre à Sake;entrepôt agricole, stockage, béton armé;Genie civil;L3;"""Comment dimensionner la structure d'un entrepôt à Sake pour assurer sa stabilité tout en intégrant des dispositifs de ventilation naturelle pour la conservation des produits ?""";Assurer la sécurité alimentaire par un stockage ventilé;Dimensionnement d une structure en béton armé à Sake;AutoCAD Revit;Étude structurale d un hangar agricole adapté aux charges de stockage
328;Dimensionnement d'une chaussée en béton bitumineux : Application sur le tronçon routier Université Catholique la Sanpietie-Station Mode.;chaussée bitumineuse, dimensionnement routier, génie civil;Genie civil;L3;"""Comment dimensionner une structure de chaussée flexible pour supporter le trafic lourd reliant le centre-ville au port de Goma ?""";Supporter le trafic lourd entre le centre-ville et le port;Dimensionnement de structure de chaussée flexible;Alizé-LCPC Civil 3D;Calcul des couches d assise pour l axe Université Catholique - Station Mode
329;Analyse dynamique d’une ossature en béton armé et celle en acier: Application sur le poteau d’un bâtiment commercial R+4;ossature béton armé, ossature acier, analyse dynamique;Genie civil;TECH2;"""Comment les propriétés de l'acier influencent-elles la réponse dynamique d'un bâtiment R+4 face aux secousses du rift à Bukavu ?""";Choisir le matériau optimal face aux secousses du Rift;Analyse dynamique comparée et réponse spectrale;Robot Structural SAP2000;Évaluation de la performance des structures mixtes en zone sismique
330;ETUDE DE L'INFLUENCE DE CERTAINS AJOUTS SUR LES CIMENTS: cas des ciments ulitisés dans la ville de BUKAVU;ajouts cimentaires, résistance mécanique, ciments locaux;Genie civil;TECH2;"""Quelle est l'influence des ajouts minéraux sur la résistance à la compression et la durabilité des mortiers à base de ciments de Bukavu ?""";Améliorer la durabilité des mortiers en environnement humide;Tests de résistance à la compression et porosité;Presse béton Microscope;Influence des ajouts locaux sur la capillarité des bétons à Bukavu
331;Conception et dimensionnement d'un bâtiment R+3 en béton armé servant d'une  maison carcérale pour mineurs en ville de Goma.;maison carcérale, béton armé, bâtiment r+3;Genie civil;L3;Comment concilier sécurité pénitentiaire et solidité structurelle d'un bâtiment R+3 ?;Amélioration des conditions et sécurité;Analyse sismique et dimensionnement murs porteurs;Béton armé, AutoCAD;Étude structurelle spécifique pour une maison carcérale
