ID;thesis_title;thesis_keywords;student_faculty;student_level;Problématique;interet;Méthode;technologies;description_sujet
1;"Conception et etude statique du tablier en acier d'un pont suspendu de 170m de portée.
Ouvrage à ériger sur l'axe Nzulo-Matanda";pont suspendu, tablier acier, génie civil, charge, stabilité;Genie civil;L3;"""Comment dimensionner un tablier en acier de 170m pour garantir sa stabilité statique sous des charges mobiles dans un environnement à relief accidenté ?""";Faciliter le transit sécurisé des marchandises sur un axe à relief montagneux (Butembo), réduisant les risques de rupture de charge.;Calcul des efforts de tension dans les câbles, dimensionnement du tablier mixte et vérification de la stabilité des culées sur versants pentus;Robot Structural Analysis, BIM (Revit Structure).;Conception d'un pont suspendu de 170m intégrant des solutions de stabilité aérodynamique.
2;VALORISATION DES DECHETS DE VERRE COMME SUBSTITUT PARTIEL AUX GRANULATS DANS LA FABRICATION DU BETON : ETUDE EXPERIMENTALE DES PROPRIETES MECANIQUES ET DE LA DURABILITE;béton recyclé, déchets de verre, granulats, durabilité, propriétés mécaniques;Genie civil;L3;"""Peut-on substituer partiellement les granulats naturels par du verre recyclé tout en maintenant la résistance mécanique et la durabilité du béton ?""";Réduction de l'empreinte carbone et gestion des déchets vitreux à Goma.;Formulation expérimentale Dreux-Gorisse avec analyse de la réaction alcali-silice.;Presse hydraulique, MATLAB (optimisation).;Valorisation du verre recyclé comme substitut granulaire pour un béton écologique.
3;"Optimisation du déplacement d'une poutre en treillis Warren sur base des indicateurs morphologiques appuyée sur les lignes d'influence. 
Application à un pont de 20m";poutre treillis Warren, optimisation, indicateurs morphologiques, lignes d’influence, pont 20m;Genie civil;L3;"""Comment utiliser les lignes d'influence pour optimiser le positionnement des charges et minimiser les contraintes internes d'une poutre en treillis Warren ?""";Rentabilisation des matériaux pour les ouvrages d'art de 20m.;Analyse itérative des lignes d'influence et optimisation topologique des nœuds.;SAP2000, Python (Scripting).;Optimisation structurelle d'une poutre Warren visant le ratio poids/résistance maximal.
4;Optimisation des méthodes de conceptions expérimentales  pour améliorer les propriétés mécaniques et de durabilités du Béton fait à base d'agrégats recyclés.; béton recyclé, agrégats, formulation, performances mécaniques, durabilité;Genie civil;TECH2;"Comment optimiser mathématiquement les plans d'expériences pour maximiser la durabilité et les performances du béton à base d'agrégats recyclés ?""";Fiabilisation des matériaux de récupération pour la reconstruction urbaine.;Méthode des surfaces de réponse (Plans d'expériences) pour la durabilité.;Minitab, Presse à béton.;Optimisation mathématique des mélanges de béton recyclé pour maximiser la résistance.
5;CONCEPTION ET DIMENSIONNEMENT D’UN SYSTEME DE DRAINAGE DES EAUX PLUVIAL D’UNE ROUTE URBAINE, CAS DE LA TRONCON TERMINUS-ROND POINT ULPGL-HOTEL KARIBU;"drainage eaux pluviales, route urbaine, assainissement, dimensionnement
";Genie civil;L3;"""Comment dimensionner un réseau d'évacuation gravitaire capable de gérer des débits de pointe sur un tronçon à forte pente tout en protégeant la structure de la chaussée contre l'affouillement et l'érosion pluviale ?""";Digitalisation du contrôle technique des bâtiments industriels à Bunia.;Analyse comparative : Calcul aux États Limites vs Modélisation Numérique.;Robot Structural Analysis, Tekla Structures.;Audit de fiabilité des structures métalliques pour garantir la sécurité des ERP à Bunia.
6;Étude du degré de fiabilité des calculs manuels des structures métalliques. Application sur un hangar à l'hôpital général de la référence de Bunia.;fiabilité calculs manuels, structures métalliques, hangar, vérification, sécurité;Genie civil;TECH2;"""Quelle est la marge d'erreur entre les méthodes de calcul manuel et les simulations numériques pour garantir la sécurité structurelle des hangars de grande portée ?""";Optimisation du coût des immeubles R+5 en zone sismique (Goma).;Analyse modale spectrale et étude de l'excentricité des masses.;ETABS, Advance Design.;Analyse de l'impact de la disposition des voiles sur la rentabilité et la résilience sismique.
7;INFLUENCE DE LA DISPOSITION DES ELEMENTS STRUCTURAUX SUR LA RENTABILITE ECONOMIQUE DES STRUCTURES EN BA .APPLICATION A UN IMMEUBLE RDC+5 A GOMA; disposition éléments structuraux, rentabilité économique, béton armé, immeuble RDC+5, optimisation;Genie civil;TECH2;"""Dans quelle mesure l'agencement des éléments porteurs impacte-t-il le coût de construction tout en respectant les normes parasismiques en zone volcanique ?""";Promotion de l'éco-construction durable et saine pour les orphelins.;Dimensionnement aux Eurocodes 5 et traitement par imprégnation.;SketchUp Pro, RFEM.;Conception d'une structure R+2 en bois maximisant le confort thermique et la stabilité.
8;Conception et dimensionnement d'un immeuble R+2 servant d'un orphelinat en bois à goma; immeuble R+2, structure bois, conception, dimensionnement;Genie civil;L3;"""Comment dimensionner une structure R+2 en bois pour assurer sa stabilité mécanique et sa durabilité face aux agents biologiques et climatiques tropicaux ?""";Réduction drastique de la facture énergétique des bâtiments de la FSTA.;Logique floue pour la régulation lumineuse et monitoring temps réel.;Arduino IDE, Node-RED (IoT).;Système domotique d'éclairage intelligent avec supervision à distance pour la gestion d'énergie.
9;Conception et dimensionnement d’un bâtiment en béton armé R+3: A usage d’un Hôpital au Sud-Kivu à d’Idjwi/Groupement Mugote;hôpital R+3,béton armé,dimensionnement,structure,génie civil, Sud-Kivu, infrastructure sanitaire;Genie civil;L3;"""Comment dimensionner une structure hospitalière R+3 en béton armé pour répondre aux exigences de sécurité et de fonctionnalité en zone de climat tropical ?""";Assurer la pérennité des soins sur l'île d'Idjwi face aux contraintes d'accès.;Analyse de la portance des sols argileux et calcul sous vent lacustre.;Arche Ossature, Revit (BIM).;Dimensionnement complet d'une infrastructure médicale R+3 adaptée au milieu insulaire du Sud-Kivu.
10;ETUDE COMPARATIVE DE METHODES DE DIMENSIONNEMENT  DES FOSSES SEPTIQUES ET OPTIMISATION DE LA MISE EN ŒUVRE DANS UN SOL ROCHEUX. CAS D’UNE FOSSE SEPTIQUE D’UN APPARTEMENT R+4 DANS LA VILLE DE GOMA.;" fosse septique,sol rocheux,assainissement,dimensionnement; mise en œuvre,génie civil, traitement eaux usées";Genie civil;L3;"""Quelle est la méthode de dimensionnement la plus efficiente pour des fosses septiques installées dans des sols rocheux à faible perméabilité ?""";Prévenir la pollution de la nappe phréatique à Goma sur socle basaltique.;Étude de perméabilité in situ et optimisation du blindage étanche.;AutoCAD, Logiciels de modélisation hydraulique.;Analyse comparative visant à définir la structure de traitement des eaux usées en terrain rocheux.
11;Conception et dimensionnement d’une gare routière moderne en béton armé au rond point kihisi à goma;gare routière,béton armé,infrastructure transport,dimensionnement;Genie civil;L3;"""Comment optimiser le dimensionnement d'une infrastructure de transport routier en béton armé pour supporter des charges lourdes constantes ?""";Fluidifier le transport urbain au point d'entrée Nord de Goma (Kihisi).;Calcul des dalles à forte résistance et modélisation de la circulation lourde.;Robot Structural Analysis, InfraWorks.;Conception structurelle d'une plateforme de transport durable pour trafic intense.
12;Étude comparative des performances hydriques et mécaniques du béton et du mortier fait à base des hydrofuges courants à Goma : cas du Sikalite (type leak seal) et Dr. Fixit.;hydrofuge,béton,mortier,imperméabilité,perméabilité,Sikalite,Dr Fixit,durabilité, performances mécaniques,étude comparative;Genie civil;L3;"""Dans quelle mesure l'ajout d'adjuvants hydrofuges et de Sikalite modifie-t-il la porosité et la durabilité des mortiers de ciment ?""";Améliorer la durabilité des fondations à Goma face aux sols volcaniques.;Essais comparatifs d'absorption d'eau et tests de pression hydrostatique.;Appareils de mesure d'humidité, Analyse statistique.;Étude expérimentale sur l'efficacité des hydrofuges de masse pour protéger les structures en béton.
13;Conception et réalisation d'une aérogare résistant aux efforts climatiques : cas de l’aéroport international de GOMA;architecture, aérogare, aéroport, climatiques, conception, de, durabilité, efforts, goma, infrastructures, international, transport;Genie civil;L3;"""Comment adapter la conception structurelle et les matériaux d'une aérogare pour résister aux contraintes thermiques et climatiques extrêmes ?""";Renforcer l'infrastructure aéroportuaire face aux gaz corrosifs du volcan.;Calcul de charpente métallique complexe et simulation anti-corrosion.;Tekla Structures, Robot Structural Analysis.;Projet d'ingénierie aéroportuaire intégrant des matériaux de haute durabilité environnementale.
14;ETUDE DE L’AMENAGEMENT D’UNE CHAUSSEE EN PAVEE VOLCANIQUE RELIANT LA RN2 A LA ROUTE L’ULPGL;chaussée pavée,pavés volcaniques,aménagement routier,RN2,ULPGL,génie civil, sécurité, matériaux locaux;Genie civil;L3;"""Quelle structure de chaussée en pavés autobloquants est la plus adaptée pour stabiliser durablement une voie à fort trafic en zone urbaine ?""";Valoriser la pierre de lave pour une voirie urbaine durable et esthétique.;Dimensionnement du corps de chaussée et étude de l'adhérence des pavés.;Civil 3D, Essais Los Angeles.;Conception d'une chaussée urbaine optimisant l'usage de la pierre volcanique locale.
15;CONCEPTION ET DIMENSIONNEMENT D’UNE STRUCTURE EN B.A. :CAS D’UN CENTRE DE SANTÉ EN ZONE RURALE;centre de santé,béton armé,zone rurale,structure,dimensionnement,infrastructure sanitaire,génie civil;Genie civil;L3;"""Comment concevoir une structure en béton armé pour un centre de santé qui optimise à la fois le coût et la sécurité dans une zone rurale isolée ?""";Offrir une infrastructure médicale robuste et à bas coût en zone rurale.;Optimisation de la descente de charges et coffrages rationnels.;AutoCAD, Excel (BAEL).;Conception d'un centre de santé sécurisé privilégiant l'efficacité structurelle et financière.
16;Contribution à l’étude des bétons recyclés : impact du mode de mise en œuvre sur leurs performances mécaniques.;béton recyclé,mise en œuvre,performances mécaniques,durabilité,matériaux,génie civil,recyclage;Genie civil;L3;"""Peut-on optimiser la stabilisation des briques en terre pour la construction de logements économiques en utilisant des ressources latéritiques locales ?""";Réduire le coût des matériaux à Goma en recyclant les débris de démolition urbaine.;Analyse comparative des cycles de malaxage et d'influence du compactage sur la porosité.;Presse hydraulique, MATLAB (modélisation), Capteurs de cure.;Recherche sur les protocoles de mise en œuvre pour garantir la résistance des bétons issus du recyclage.
17;Etude d'un Eco-béton à  base de terre stabilisé  au ciment : Application au sol de KATANA(SUD-KIVU);eco‑béton,terre stabilisée,ciment,Katana,Sud‑Kivu,matériaux locaux,durabilité, construction durable;Genie civil;TECH2;"""Comment garantir la stabilité structurelle et l'étanchéité d'un tunnel immergé soumis à des pressions hydrostatiques importantes ?""";Promouvoir l'habitat social durable par l'usage de la terre latéritique locale.;Analyse de la stabilisation physico-chimique (Terre-Ciment-Chaux) et tests de retrait linéaire.;Développement d'un matériau hybride pour réduire le coût de la construction tout en préservant l'environnement à Katana.;Projet de pointe traitant des défis de la construction subaquatique en milieu lacustre profond.
18;Etude en vue du dimensionnement d’un tunnel immergé reliant la Province du Nord-Kivu à celle du Sud Kivu via la localité de Nzulo;tunnel immergé,lac Kivu,Nzulo,infrastructure transport,dimensionnement,génie civil, Nord‑Kivu,Sud‑Kivu;Genie civil;TECH2;"""Comment dimensionner une installation de conservation frigorifique pour minimiser les pertes énergétiques tout en garantissant la sécurité alimentaire ?""";Créer une liaison stratégique sous le lac Kivu pour sécuriser le transport interprovincial.;Analyse de la pression hydrostatique profonde et étude des joints d'étanchéité haute performance.;Plaxis 3D (Géotechnique marine), SAP2000, Simulations CFD (Fluides).;Projet d'infrastructure de pointe traitant des défis de la construction subaquatique et de l'interaction sol-structure en milieu lacustre.
19;Réalisation et dimensionnement d'une mini chambre froide :  cas alimentaire animale;chambre froide,conservation alimentaire,dimensionnement,réfrigération,thermique, alimentation animale,conception;Genie civil;L3;"""Quelles sont les spécificités du dimensionnement des infrastructures ferroviaires pour supporter des convois lourds sur de longues distances ?""";Sécuriser la chaîne de froid pour l'élevage local et réduire le gaspillage alimentaire.;Bilan thermique des parois, calcul de la puissance frigorifique et choix des isolants.;Revit (MEP), Logiciels de calcul thermique, Thermostats connectés.;Conception d'une infrastructure de stockage réfrigérée optimisée pour la conservation des produits d'origine animale.
20;Drainage des eaux pluviales du quartier MABANGA-SUD;drainage urbain,eaux pluviales,assainissement,quartier Mabanga‑Sud, hydrologie, génie civil;Genie civil;TECH2;"""Quelle est l'influence de la disposition des voiles de contreventement sur la réponse dynamique d'un bâtiment R+3 en zone à forte activité sismique ?""";Prévenir les inondations récurrentes et l'érosion des voiries dans le quartier Mabanga-Sud.;Calcul des débits de ruissellement et dimensionnement des collecteurs gravitairement.;AutoCAD Civil 3D, Storm and Sanitary Analysis (SSA), SIG.;Conception d'un réseau d'évacuation gravitaire adapté à la pluviométrie intense et à la topographie de Mabanga-Sud.
21;Conception, Études et réalisation d'un chemin de fer reliant la ville de Goma du territoire de Walikale : 235km;chemin de fer,infrastructure ferroviaire,Goma‑Walikale,235 km,transport,tracé, génie civil;Genie civil;TECH2;"""L'utilisation de cendres de bagasse comme substitut au ciment permet-elle de produire des briques en terre stabilisée conformes aux normes de construction ?""";Désenclaver Walikale pour faciliter l'évacuation des minerais et des produits agricoles.;Étude du tracé ferroviaire, calcul de la superstructure (rails/ballast) et des ouvrages d'art.;Bentley OpenRail, Robot Structural Analysis, Global Mapper.;Projet d'infrastructure ferroviaire majeure de 235km traitant des défis du relief et de la portance des sols.
22;INFLUENCE DE LA PERFORMANCE DES JOINTS PARASSISMIQUES ET DE CONTREVENTEMENT SUR UNE STRUCTURE DE FORME REGULIERE DANS LA VILLE DE GOMA : APPLICATION A UNE STRUCTURE R+3 SERVANT DE PRISON;joints parasismiques,contreventement,sismique,béton armé,structure régulière, prison R+3,Goma;Genie civil;TECH2;"""Comment évaluer la vulnérabilité sismique de bâtiments résidentiels existants sur des sols à faible capacité portante pour proposer des renforcements adaptés ?""";Garantir la sécurité structurelle des bâtiments pénitentiaires face aux séismes de Goma.;Analyse de l'entrechoquement des blocs et dimensionnement des joints de rupture sismique.;ETABS, SAP2000, Normes parasismiques.;Étude de l'impact des joints de dilatation et de contreventement sur la réponse dynamique d'une structure régulière.
23;Évaluation de la performance mécanique des briques en terre stabilisée avec ce+B41+B29:D41+B29:E41+B41+B29:D41+B29:G41+B29:F41+B29:F42+B29:B29:F42;brique terre stabilisée,cendre bagasse,ciment,matériaux locaux,performance mécanique,durabilité;Genie civil;TECH2;"""Dans quelle mesure l'incorporation de cendres de bagasse comme substitut au ciment influence-t-elle la résistance mécanique et la durabilité des briques en terre ?""";Valoriser les déchets industriels (bagasse) pour créer des matériaux de construction écologiques.;Essais de compression et de durabilité sur des briques stabilisées au ciment et cendres.;Presse hydraulique, MATLAB (analyse des résultats), Labo géotechnique.;Recherche expérimentale visant à optimiser la résistance des briques en terre par l'ajout de cendres de bagasse.
24;Etude de la vulnerabilite sismique des batiments residentiels a Goma et propositions de solutions techniques de renforcement adaptées;vulnérabilité sismique,bâtiments résidentiels,Goma,renforcement structurel,génie civil,risque sismique;Genie civil;TECH2;"""Comment évaluer le degré de vulnérabilité structurelle des bâtiments existants face aux risques sismiques locaux pour proposer des stratégies de renforcement adaptées ?""";Réduire les risques de pertes humaines par le renforcement des maisons existantes.;Évaluation par indice de vulnérabilité et proposition de solutions de chemisage ou renforcement.;SAP2000, Sismographes, Fiches d'inspection technique;Diagnostic structurel du parc résidentiel de Goma et guide technique de réhabilitation parasismique.
25;ÉTUDE DU COMPORTEMENT DYNAMIQUE D’UN BÂTIMENT SUR UN SITE À RISQUE VOLCANIQUE ET SISMIQUES: APPLICATION À LA VILLE DE GOMA;"comportement dynamique,bâtiment,site volcanique,sismique,Goma; analyse structurale";Genie civil;TECH2;"""Comment modéliser l'interaction entre les ondes sismiques et une structure implantée sur un sol basaltique/volcanique pour garantir sa stabilité dynamique ?""";Adapter les structures de Goma aux doubles contraintes de secousses et de sols basaltiques.;Analyse modale et simulation de l'interaction sol-structure (ISS).;Robot Structural Analysis, Plaxis, Accélérogrammes réels.;Modélisation avancée de la réponse d'un bâtiment face aux ondes sismiques en milieu volcanique.
26;"Modélisation par éléments finis de la
liquéfaction des sols sous chargements
sismiques : application à la ville de Bukavu";liquéfaction des sols,éléments finis,sismique,Bukavu,géotechnique,chargements dynamiques;Genie civil;TECH2;"""Comment utiliser la simulation numérique pour prédire le risque de liquéfaction des sols saturés sous sollicitations sismiques et prévenir l'effondrement des fondations ?""";Prévenir l'effondrement des fondations à Bukavu dû à la perte de résistance des sols saturés.;Modélisation numérique du potentiel de liquéfaction et analyse des pressions de pores.;PLAXIS 2D/3D, ABAQUS, Essais SPT/CPT.;Simulation par éléments finis pour prédire le risque de liquéfaction des sols de Bukavu sous séisme.
27;"Analyse sismique comparative des structures en
portique et en structures en voiles en béton armé : application à un bâtiment R+7 à usage administratif.";analyse sismique comparative,portiques,voiles en béton armé,bâtiment R+7,usage administratif,parasismique;Genie civil;TECH2;"""Quelle est l'influence de la rigidité des voiles en béton armé sur la redistribution des efforts dans les structures portiques soumises à des secousses sismiques ?""";Déterminer le système structurel le plus efficace pour les immeubles de bureaux R+7 à Goma.;Comparaison des déplacements inter-étages et des sollicitations entre portiques et voiles.;ETABS, Advance Design, AutoCAD.;Étude comparative visant à optimiser le contreventement d'un bâtiment administratif R+7 en zone sismique.
28;Étude du comportement sismique des bâtiments en béton armé à Goma, modélisation et optimisation des contreventements. Application sur un bâtiment R+7 à usage administratif;bâtiments béton armé,comportement sismique,contreventement,portiques,Goma, optimisation structurale;Genie civil;TECH2;"""Comment optimiser la configuration du contreventement pour limiter les déplacements inter-étages et les dommages structurels lors d'un séisme majeur ?""";Affiner la configuration des murs de cisaillement pour minimiser le coût et maximiser la sécurité.;Optimisation de l'emplacement des voiles de contreventement.;ETABS, Robot Structural Analysis, Excel (Optimiseur).;Recherche sur la disposition optimale des éléments porteurs pour stabiliser un immeuble R+7 à Goma.
29;Étude du comportement à long terme des sols sous charges permanentes : application à la stabilité des fondations des bâtiments;sols compressibles,charges permanentes,fluage,stabilité fondations,génie géotechnique;Genie civil;TECH2;"""Comment prédire l'évolution des tassements de consolidation à long terme des structures fondées sur des sols compressibles sous l'effet de charges constantes ?""";Prévenir les tassements excessifs qui causent des fissures dans les grands édifices de Goma.;Modélisation du fluage et consolidation primaire/secondaire des sols compressibles.;Plaxis 2D/3D, Oedomètre automatique, Python (modélisation prédictive).;Analyse géotechnique approfondie de l'évolution des tassements sur 20 ans pour garantir la stabilité structurelle.
30;"DRAINAGE DES EAUX PLUVIALES 
STAGNANTS SUR LES VOIES 
PUBLIQUES EN VILLE DE GOMA « CAS 
DU TRONCON VISION 20-20 KIHISI »";drainage eaux pluviales,voies publiques,tronçon Vision 20‑20,Kihisi,Goma assainissement urbain;Genie civil;TECH2;"""Comment concevoir un exutoire et un réseau de drainage capables d'évacuer durablement les eaux stagnantes dans les zones de cuvettes topographiques urbaines ?""";Éradiquer les poches d'eau qui détruisent la chaussée au niveau du tronçon Vision 20-20 à Kihisi.;Modélisation hydraulique de surface et conception de bassins de rétention optimisés.;Autodesk InfoDrainage, Civil 3D, Storm and Sanitary Analysis (SSA).;Conception d'un système d'assainissement routier durable pour éliminer la stagnation des eaux en zone urbaine.
31;"Amélioration parasismique des structures en zone tropicale par l’utilisation des matériaux locaux et des fibres naturelles : Cas d’étude dans une région sismique d’Afrique centrale; précisément en GOMA";structures parasismiques,matériaux locaux,fibres naturelles,zone tropicale,Goma, sismique,génie civil;Genie civil;TECH2;"""Dans quelle mesure l'intégration de matériaux locaux et biosourcés peut-elle améliorer la résilience et la capacité d'absorption d'énergie des structures en zone sismique ?""";Réduire la vulnérabilité sismique du Nord-Kivu avec des matériaux écologiques et accessibles.;Modélisation non-linéaire de béton renforcé par fibres végétales et essais de ductilité.;SAP2000, Abaqus (User Subroutines), Machine d'essais universelle.;Étude expérimentale et numérique de l'apport des fibres naturelles dans la résistance aux séismes.
32;Optimisation du choix du type de fondation pour la stabilité d’un pont mixte acier-béton sur sol instable : Cas du pont Makelele, territoire de Kalehe.;pont mixte acier‑béton,fondations,sol instable,stabilité,Makelele,Kalehe,génie civil;Genie civil;TECH2;"""Quels sont les critères décisionnels techniques et économiques pour choisir le système de fondation le plus stable sur un sol instable pour un pont mixte ?""";Assurer le désenclavement de Kalehe par un pont résistant aux sols instables.;Analyse multicritère (AHP) entre fondations profondes et semi-profondes sur sol mou.;Robot Structural Analysis, Midas Civil, Plaxis 3D.;Conception structurelle et géotechnique d'un pont mixte acier-béton optimisée pour les sols de Kalehe.
33;ETUDES TECHNIQUES D'IMPERMEABILISATION DES BASSINS DE COLLECTE DES EAUX DE RUISSELLEMENT;bassins de collecte,eaux de ruissellement,étanchéité,durabilité,génie civil, gestion eaux pluviales;Genie civil;TECH2;"""Quelles techniques d'imperméabilisation par géomembranes ou traitements chimiques sont les plus efficaces pour stopper l'érosion interne des bassins de collecte ?""";Protéger les nappes phréatiques et optimiser le stockage des eaux de ruissellement à Goma.;Analyse de l'étanchéité par géomembranes vs argiles compactées et tests de perméabilité.;Hec-Ras, AutoCAD, Essais de perméabilité in-situ.;Étude technique des dispositifs d'étanchéité pour la gestion efficace et durable des eaux pluviales.
34;ÉVALUATION EXPERIMENTALE DE LA PERFORMANCE DES FONDATIONS SUR PIEUX DANS UN SOL SOUMIS A L’EROSION : CAS DE LA ZONE DE KARHALE A BUKAVU”;fondations sur pieux,érosion,Karhale,Bukavu,essais géotechniques, capacité portante;Genie civil;TECH2;"""Comment l'érosion régressive des sols influence-t-elle la capacité portante limite et le frottement latéral des pieux fondés dans des zones de glissement ?""";Sécuriser les bâtiments sur les collines érodées de Bukavu (Karhale) pour éviter les effondrements.;Analyse de la réduction de la capacité portante latérale des pieux due au déchaussement.;Settle3, Capteurs de pression, Modélisation par éléments finis.;Recherche expérimentale sur l'interaction sol-pieux dans les zones de Bukavu soumises à l'érosion.
